Rank,name,Sum,333,222,444,555,666,777,333bf,333oh,clock,minx,pyram,skewb,sq1
1.0,Gerardo Varela,58.0,7.0,3.0,7.0,3.0,3.0,3.0,2.0,5.0,5.0,5.0,4.0,4.0,7.0
2.0,Luis David Hernández Mejía,62.0,6.0,7.0,4.0,1.0,1.0,1.0,3.0,4.0,3.0,9.0,6.0,9.0,8.0
3.0,Fabio Lenin Tabora Castillo,85.0,8.0,9.0,8.0,9.0,4.0,3.0,3.0,7.0,5.0,8.0,5.0,7.0,9.0
4.0,Juan Carlos Boquín Izaguirre,90.0,9.0,4.0,12.0,7.0,4.0,3.0,3.0,22.0,5.0,11.0,1.0,5.0,4.0
5.0,José Lisandro Velásquez Martínez,94.0,2.0,5.0,2.0,10.0,4.0,3.0,3.0,6.0,5.0,1.0,11.0,33.0,9.0
6.0,Jose Carlo Valladares,104.0,10.0,18.0,3.0,10.0,4.0,3.0,3.0,11.0,5.0,15.0,12.0,1.0,9.0
7.0,Dorian Ernesto Rosales Rodriguez,124.0,24.0,19.0,16.0,2.0,2.0,2.0,3.0,12.0,2.0,17.0,13.0,6.0,6.0
8.0,Javier Armando Cruz Santos,131.0,28.0,6.0,23.0,10.0,4.0,3.0,3.0,10.0,5.0,7.0,9.0,14.0,9.0
8.0,Danniel Andrés Orellana Alvarado,131.0,11.0,8.0,13.0,10.0,4.0,3.0,3.0,16.0,5.0,2.0,14.0,33.0,9.0
10.0,Sara Abigail Cubas Cálix,132.0,27.0,27.0,11.0,10.0,4.0,3.0,3.0,12.0,4.0,4.0,7.0,11.0,9.0
11.0,Miguel Angel Edelman Vindel,146.0,1.0,1.0,1.0,10.0,4.0,3.0,3.0,1.0,5.0,20.0,55.0,33.0,9.0
12.0,Rommel Alexander Reyes Nuñez,152.0,14.0,20.0,15.0,8.0,4.0,3.0,3.0,19.0,5.0,3.0,16.0,33.0,9.0
13.0,Oscar Salomón Martínez Moreno,157.0,41.0,15.0,31.0,10.0,4.0,3.0,3.0,21.0,1.0,13.0,3.0,3.0,9.0
14.0,Fares Daniel Flores Hernández,163.0,3.0,2.0,48.0,10.0,4.0,3.0,3.0,2.0,5.0,20.0,21.0,33.0,9.0
15.0,Alejandro Jose Amador Cruz,165.0,21.0,11.0,21.0,10.0,4.0,3.0,3.0,35.0,5.0,14.0,2.0,27.0,9.0
16.0,Nelson Alonso Hernández Sánchez,171.0,12.0,10.0,10.0,6.0,4.0,3.0,3.0,17.0,5.0,20.0,57.0,15.0,9.0
17.0,Oscar Armando Sauceda Benavidez,183.0,17.0,25.0,20.0,10.0,4.0,3.0,3.0,15.0,5.0,20.0,25.0,33.0,3.0
18.0,Néstor Emil Rodríguez Flores,185.0,31.0,38.0,9.0,5.0,4.0,3.0,3.0,41.0,5.0,20.0,15.0,2.0,9.0
19.0,Danny Joel Pacheco Umaña,204.0,16.0,17.0,48.0,10.0,4.0,3.0,3.0,18.0,5.0,20.0,18.0,33.0,9.0
20.0,Ramon Eduardo Yip Yip,220.0,13.0,44.0,5.0,4.0,4.0,3.0,3.0,9.0,5.0,20.0,68.0,33.0,9.0
21.0,Anthony Gabriel Torres Mejia,229.0,37.0,16.0,48.0,10.0,4.0,3.0,3.0,41.0,5.0,20.0,23.0,10.0,9.0
22.0,Harry Daniels Aguilar Alvarado,237.0,5.0,12.0,48.0,10.0,4.0,3.0,3.0,8.0,5.0,20.0,77.0,33.0,9.0
23.0,Erick Y. Maldonado,254.0,38.0,39.0,26.0,10.0,4.0,3.0,3.0,27.0,5.0,20.0,45.0,33.0,1.0
23.0,Elias Antonio Alvarez Ramos,254.0,57.0,42.0,33.0,10.0,4.0,3.0,3.0,25.0,5.0,20.0,10.0,33.0,9.0
25.0,Jonathan Pavón Gómez,255.0,23.0,27.0,48.0,10.0,4.0,3.0,3.0,3.0,5.0,10.0,77.0,33.0,9.0
26.0,Andres Eduardo Carias Colindres,258.0,21.0,13.0,28.0,10.0,4.0,3.0,3.0,32.0,5.0,20.0,77.0,33.0,9.0
27.0,Nelson Josué Vasquez Zambrano,263.0,15.0,26.0,17.0,10.0,4.0,3.0,3.0,41.0,5.0,20.0,77.0,33.0,9.0
27.0,Dennis Josue Blanco,263.0,19.0,35.0,6.0,10.0,4.0,3.0,1.0,41.0,5.0,20.0,77.0,33.0,9.0
27.0,Ubilson Abieser Hernández Mejía,263.0,19.0,67.0,42.0,10.0,4.0,3.0,3.0,41.0,5.0,20.0,7.0,33.0,9.0
30.0,Diego Alfredo Medina,265.0,45.0,29.0,39.0,10.0,4.0,3.0,3.0,24.0,5.0,20.0,49.0,25.0,9.0
31.0,Isaac Ayala,273.0,71.0,34.0,48.0,10.0,4.0,3.0,3.0,41.0,5.0,20.0,17.0,8.0,9.0
32.0,Andrés Rubio,276.0,46.0,24.0,48.0,10.0,4.0,3.0,3.0,41.0,5.0,20.0,30.0,33.0,9.0
32.0,Lester Alvarado Reyes,276.0,43.0,40.0,32.0,10.0,4.0,3.0,3.0,41.0,5.0,18.0,51.0,17.0,9.0
34.0,Alix Josue Calix Tinoco,291.0,56.0,56.0,40.0,10.0,4.0,3.0,3.0,28.0,5.0,20.0,24.0,33.0,9.0
35.0,Erick Daniel Sandoval Puerto,292.0,61.0,37.0,37.0,10.0,4.0,3.0,3.0,41.0,5.0,20.0,29.0,33.0,9.0
36.0,Jerson Saravia,294.0,47.0,46.0,29.0,10.0,4.0,3.0,3.0,41.0,5.0,20.0,44.0,33.0,9.0
37.0,Jairo Rodriguez,296.0,35.0,45.0,19.0,10.0,4.0,3.0,3.0,41.0,5.0,20.0,73.0,33.0,5.0
37.0,Sergio Navarro,296.0,74.0,51.0,34.0,10.0,4.0,3.0,3.0,34.0,5.0,20.0,36.0,13.0,9.0
39.0,Gabriel Hernández,297.0,60.0,30.0,48.0,10.0,4.0,3.0,3.0,41.0,5.0,20.0,31.0,33.0,9.0
40.0,Percy Yassir Ferrera Hernández,304.0,44.0,31.0,24.0,10.0,4.0,3.0,3.0,41.0,5.0,20.0,77.0,33.0,9.0
41.0,Gareth Daniel Romero Espinal,306.0,67.0,43.0,48.0,10.0,4.0,3.0,3.0,39.0,5.0,20.0,22.0,33.0,9.0
42.0,Carlos Roberto Bueso Enamorado,312.0,25.0,105.0,27.0,10.0,4.0,3.0,3.0,41.0,5.0,20.0,27.0,33.0,9.0
42.0,David Alexis Raudales Oseguera,312.0,55.0,14.0,48.0,10.0,4.0,3.0,3.0,38.0,5.0,20.0,77.0,33.0,2.0
44.0,Fernando David Banegas Moreno,313.0,58.0,66.0,48.0,10.0,4.0,3.0,3.0,41.0,5.0,20.0,20.0,26.0,9.0
45.0,Emerson Mejia,314.0,40.0,21.0,48.0,10.0,4.0,3.0,3.0,41.0,5.0,20.0,77.0,33.0,9.0
46.0,Harvin Eliam Pérez Inestroza,315.0,30.0,32.0,48.0,10.0,4.0,3.0,3.0,41.0,5.0,20.0,77.0,33.0,9.0
46.0,Camilo Tellez,315.0,39.0,23.0,48.0,10.0,4.0,3.0,3.0,41.0,5.0,20.0,77.0,33.0,9.0
48.0,Cristian David Flores Contreras,321.0,48.0,70.0,25.0,10.0,4.0,3.0,3.0,29.0,5.0,20.0,62.0,33.0,9.0
49.0,Rene Adolfo Merino Ruiz,325.0,77.0,49.0,44.0,10.0,4.0,3.0,3.0,41.0,5.0,20.0,38.0,22.0,9.0
50.0,Angel David Rodriguez Hernandez,328.0,42.0,33.0,48.0,10.0,4.0,3.0,3.0,41.0,5.0,20.0,77.0,33.0,9.0
51.0,José Adonis Lemus Mejía,335.0,4.0,105.0,48.0,10.0,4.0,3.0,3.0,14.0,5.0,20.0,77.0,33.0,9.0
52.0,Axel Jael García Rubio,336.0,49.0,48.0,48.0,10.0,4.0,3.0,3.0,41.0,5.0,20.0,63.0,33.0,9.0
53.0,Darío Ernesto Cruz Flores,337.0,69.0,22.0,48.0,10.0,4.0,3.0,3.0,41.0,5.0,20.0,70.0,33.0,9.0
54.0,Angelli Rivera,339.0,76.0,55.0,38.0,10.0,4.0,3.0,3.0,41.0,5.0,12.0,50.0,33.0,9.0
54.0,Nelson Johan Caballero Discua,339.0,54.0,63.0,48.0,10.0,4.0,3.0,3.0,33.0,5.0,20.0,54.0,33.0,9.0
56.0,José Román Aguiluz Milla,342.0,59.0,41.0,41.0,10.0,4.0,3.0,3.0,41.0,5.0,16.0,77.0,33.0,9.0
56.0,Alejandro Josué Fernández Ávila,342.0,91.0,53.0,48.0,10.0,4.0,3.0,3.0,36.0,5.0,20.0,42.0,18.0,9.0
56.0,Emilio Matamoros,342.0,18.0,105.0,14.0,10.0,4.0,3.0,3.0,41.0,5.0,20.0,77.0,33.0,9.0
59.0,Carlos Fabian Espinoza Moncada,345.0,50.0,59.0,48.0,10.0,4.0,3.0,3.0,41.0,5.0,20.0,77.0,16.0,9.0
59.0,Rodrigo Caleb Solorzano Navarro,345.0,64.0,36.0,48.0,10.0,4.0,3.0,3.0,41.0,5.0,20.0,69.0,33.0,9.0
61.0,Sofia Videa,351.0,63.0,47.0,48.0,10.0,4.0,3.0,3.0,41.0,5.0,20.0,65.0,33.0,9.0
62.0,Andres David Ordonez Giron,353.0,100.0,52.0,46.0,10.0,4.0,3.0,3.0,41.0,5.0,20.0,36.0,24.0,9.0
63.0,Abdel Leonardo Azzad Luque,355.0,66.0,105.0,48.0,10.0,4.0,3.0,3.0,30.0,5.0,20.0,19.0,33.0,9.0
64.0,Víctor Jhosua Osorto Sierra,357.0,29.0,105.0,18.0,10.0,4.0,3.0,3.0,41.0,5.0,20.0,77.0,33.0,9.0
64.0,Rafael Ricardo Lopez Maradiaga,357.0,52.0,105.0,30.0,10.0,4.0,3.0,3.0,20.0,5.0,6.0,77.0,33.0,9.0
66.0,Manuel Sanchez Chinchilla,363.0,85.0,61.0,48.0,10.0,4.0,3.0,3.0,41.0,5.0,20.0,41.0,33.0,9.0
67.0,Oscar Josafat Pavón Licona,365.0,68.0,64.0,43.0,10.0,4.0,3.0,3.0,26.0,5.0,20.0,77.0,33.0,9.0
68.0,Yoel Castillo Suazo,366.0,34.0,105.0,22.0,10.0,4.0,3.0,3.0,41.0,5.0,20.0,77.0,33.0,9.0
69.0,Jorge Daniel Serrano Zamora,369.0,82.0,62.0,48.0,10.0,4.0,3.0,3.0,41.0,5.0,20.0,61.0,21.0,9.0
70.0,Kenny David Torres Menjivar,372.0,51.0,68.0,48.0,10.0,4.0,3.0,3.0,41.0,5.0,20.0,77.0,33.0,9.0
70.0,Mauricio Daniel Salgado Carrillo,372.0,26.0,105.0,36.0,10.0,4.0,3.0,3.0,41.0,5.0,20.0,77.0,33.0,9.0
72.0,Marcelo Adrian Hernández Lagos,373.0,70.0,50.0,48.0,10.0,4.0,3.0,3.0,41.0,5.0,20.0,77.0,33.0,9.0
73.0,Miguel Mejía Oviedo,376.0,36.0,105.0,48.0,10.0,4.0,3.0,3.0,23.0,5.0,20.0,77.0,33.0,9.0
74.0,Gabriel Alejandro Obando Gonzalez,380.0,62.0,65.0,48.0,10.0,4.0,3.0,3.0,41.0,5.0,20.0,77.0,33.0,9.0
75.0,Jesus Alberto Henriquez Garay,381.0,80.0,77.0,45.0,10.0,4.0,3.0,3.0,41.0,5.0,19.0,52.0,33.0,9.0
76.0,Jacobo Oyuela Velásquez,382.0,87.0,105.0,48.0,10.0,4.0,3.0,3.0,41.0,5.0,20.0,28.0,19.0,9.0
77.0,Emily Daniela Chavez Hernandez,389.0,106.0,73.0,48.0,10.0,4.0,3.0,3.0,41.0,5.0,20.0,34.0,33.0,9.0
78.0,Diego Fernando Rivera Mejía,390.0,32.0,105.0,48.0,10.0,4.0,3.0,3.0,41.0,5.0,20.0,77.0,33.0,9.0
78.0,Leony Yu Way,390.0,89.0,87.0,47.0,10.0,4.0,3.0,3.0,41.0,5.0,20.0,43.0,29.0,9.0
80.0,Daniel Alberto Cevallos Reyes,391.0,33.0,105.0,48.0,10.0,4.0,3.0,3.0,41.0,5.0,20.0,77.0,33.0,9.0
81.0,Juan Diego Pineda Galindo,394.0,84.0,57.0,48.0,10.0,4.0,3.0,3.0,41.0,5.0,20.0,77.0,33.0,9.0
82.0,Kenneth David Rodríguez Pavón,399.0,83.0,105.0,48.0,10.0,4.0,3.0,3.0,41.0,5.0,20.0,35.0,33.0,9.0
83.0,Jaffet Gustavo Gaekel Coello,400.0,73.0,105.0,48.0,10.0,4.0,3.0,3.0,31.0,5.0,20.0,77.0,12.0,9.0
84.0,Kenneth Jair Guevara Chevez,403.0,79.0,72.0,48.0,10.0,4.0,3.0,3.0,40.0,5.0,20.0,77.0,33.0,9.0
84.0,Jonathan Ricardo Romero Turcios,403.0,99.0,105.0,48.0,10.0,4.0,3.0,3.0,41.0,5.0,20.0,33.0,23.0,9.0
86.0,Luis Nelson Medina,405.0,107.0,74.0,48.0,10.0,4.0,3.0,3.0,41.0,5.0,20.0,48.0,33.0,9.0
87.0,Angel Emilio Castillo Aguilar,408.0,102.0,58.0,48.0,10.0,4.0,3.0,3.0,37.0,5.0,20.0,76.0,33.0,9.0
88.0,Zabdy Gabriel Gomez Macias,411.0,53.0,105.0,48.0,10.0,4.0,3.0,3.0,41.0,5.0,20.0,77.0,33.0,9.0
88.0,Roosevlt Noe Nuñez Rodriguez,411.0,98.0,60.0,48.0,10.0,4.0,3.0,3.0,41.0,5.0,20.0,77.0,33.0,9.0
90.0,Nilsa Kristela Flores Flores,412.0,88.0,71.0,48.0,10.0,4.0,3.0,3.0,41.0,5.0,20.0,77.0,33.0,9.0
91.0,Lucas Joel Tumlison,414.0,86.0,105.0,48.0,10.0,4.0,3.0,3.0,41.0,5.0,20.0,47.0,33.0,9.0
92.0,Xavier Alessandro Chavez David,416.0,109.0,54.0,48.0,10.0,4.0,3.0,3.0,41.0,5.0,20.0,77.0,33.0,9.0
93.0,Jose Mauricio Cantillano Enamorado,419.0,133.0,84.0,48.0,10.0,4.0,3.0,3.0,41.0,5.0,20.0,26.0,33.0,9.0
94.0,Walter Elias Ramos Mayorquin,423.0,78.0,105.0,35.0,10.0,4.0,3.0,3.0,41.0,5.0,20.0,77.0,33.0,9.0
94.0,Daniel Lara,423.0,65.0,105.0,48.0,10.0,4.0,3.0,3.0,41.0,5.0,20.0,77.0,33.0,9.0
96.0,Abdel Alberto Trochez Rios,424.0,93.0,78.0,48.0,10.0,4.0,3.0,3.0,41.0,5.0,20.0,77.0,33.0,9.0
97.0,Jonathan Antonio Mejia Chacez,430.0,72.0,105.0,48.0,10.0,4.0,3.0,3.0,41.0,5.0,20.0,77.0,33.0,9.0
98.0,Raul Antonio Sandoval Ochoa,433.0,75.0,105.0,48.0,10.0,4.0,3.0,3.0,41.0,5.0,20.0,77.0,33.0,9.0
99.0,Ricardo Daniel Trejo Trejo,435.0,122.0,105.0,48.0,10.0,4.0,3.0,3.0,41.0,5.0,20.0,32.0,33.0,9.0
100.0,Sebastián Hernández Bonilla,439.0,81.0,105.0,48.0,10.0,4.0,3.0,3.0,41.0,5.0,20.0,77.0,33.0,9.0
101.0,Pedro Luis Cabrera Acosta,440.0,104.0,83.0,48.0,10.0,4.0,3.0,3.0,41.0,5.0,20.0,77.0,33.0,9.0
102.0,Joseph Alejandro Ruiz Vallecio,442.0,134.0,79.0,48.0,10.0,4.0,3.0,3.0,41.0,5.0,20.0,53.0,33.0,9.0
102.0,Diego Jareth Villalta Alvez,442.0,151.0,89.0,48.0,10.0,4.0,3.0,3.0,41.0,5.0,20.0,39.0,20.0,9.0
102.0,Jorge Moises Hernandez,442.0,103.0,105.0,48.0,10.0,4.0,3.0,3.0,41.0,5.0,20.0,58.0,33.0,9.0
105.0,Mario Alejandro Santos Molina,443.0,92.0,98.0,48.0,10.0,4.0,3.0,3.0,41.0,5.0,20.0,77.0,33.0,9.0
105.0,Cristian Miguel Rapalo,443.0,121.0,69.0,48.0,10.0,4.0,3.0,3.0,41.0,5.0,20.0,77.0,33.0,9.0
107.0,Axel Alberto Aguilar Navas,445.0,112.0,80.0,48.0,10.0,4.0,3.0,3.0,41.0,5.0,20.0,77.0,33.0,9.0
108.0,Luis Alonzo Rapalo Najera,448.0,90.0,105.0,48.0,10.0,4.0,3.0,3.0,41.0,5.0,20.0,77.0,33.0,9.0
109.0,Jose Daniel Alvarez Pineda,450.0,110.0,105.0,48.0,10.0,4.0,3.0,3.0,41.0,5.0,20.0,59.0,33.0,9.0
110.0,Mario Josue Hernandez Lazaro,451.0,108.0,90.0,48.0,10.0,4.0,3.0,3.0,41.0,5.0,20.0,77.0,33.0,9.0
111.0,Christian Josue Andino Morales,452.0,94.0,105.0,48.0,10.0,4.0,3.0,3.0,41.0,5.0,20.0,77.0,33.0,9.0
112.0,Pablo Rejopachi,453.0,114.0,86.0,48.0,10.0,4.0,3.0,3.0,41.0,5.0,20.0,77.0,33.0,9.0
112.0,Cesar Edgardo Mejia Diaz,453.0,95.0,105.0,48.0,10.0,4.0,3.0,3.0,41.0,5.0,20.0,77.0,33.0,9.0
114.0,Diego Armando Orellana Montoya,454.0,96.0,105.0,48.0,10.0,4.0,3.0,3.0,41.0,5.0,20.0,77.0,33.0,9.0
114.0,Carlos Alexander Zelaya Alberto,454.0,127.0,76.0,48.0,10.0,4.0,3.0,3.0,41.0,5.0,20.0,77.0,31.0,9.0
116.0,Obed Isai Espinoza Valladares,455.0,97.0,105.0,48.0,10.0,4.0,3.0,3.0,41.0,5.0,20.0,77.0,33.0,9.0
117.0,Moises David Mendoza,457.0,119.0,85.0,48.0,10.0,4.0,3.0,3.0,41.0,5.0,20.0,77.0,33.0,9.0
118.0,Jeremy Umanzor,458.0,124.0,81.0,48.0,10.0,4.0,3.0,3.0,41.0,5.0,20.0,77.0,33.0,9.0
119.0,Jeferson Hernandez Caceres,459.0,101.0,105.0,48.0,10.0,4.0,3.0,3.0,41.0,5.0,20.0,77.0,33.0,9.0
120.0,Jose Alberto Hernadez Sabillon,462.0,135.0,105.0,48.0,10.0,4.0,3.0,3.0,41.0,5.0,20.0,46.0,33.0,9.0
121.0,Jose Dimas Maldonado Gonzales,463.0,120.0,90.0,48.0,10.0,4.0,3.0,3.0,41.0,5.0,20.0,77.0,33.0,9.0
121.0,Fabrico Javier Hernandez,463.0,105.0,105.0,48.0,10.0,4.0,3.0,3.0,41.0,5.0,20.0,77.0,33.0,9.0
123.0,Hugo Henry Paz Zuniga,464.0,129.0,99.0,48.0,10.0,4.0,3.0,3.0,41.0,5.0,20.0,60.0,33.0,9.0
124.0,Antonio Miguel Lardizábal Corpeño,468.0,110.0,105.0,48.0,10.0,4.0,3.0,3.0,41.0,5.0,20.0,77.0,33.0,9.0
125.0,Ernesto Sandoval Rivera,471.0,113.0,105.0,48.0,10.0,4.0,3.0,3.0,41.0,5.0,20.0,77.0,33.0,9.0
125.0,Walter Yafeth Sanchez Funez,471.0,136.0,82.0,48.0,10.0,4.0,3.0,3.0,41.0,5.0,20.0,77.0,33.0,9.0
127.0,Luis Carlos Galvez,472.0,114.0,105.0,48.0,10.0,4.0,3.0,3.0,41.0,5.0,20.0,77.0,33.0,9.0
128.0,Diego Salvador Pineda Hernandez,474.0,116.0,105.0,48.0,10.0,4.0,3.0,3.0,41.0,5.0,20.0,77.0,33.0,9.0
129.0,Gabriel Enoc Zambrano Mejia,475.0,117.0,105.0,48.0,10.0,4.0,3.0,3.0,41.0,5.0,20.0,77.0,33.0,9.0
130.0,Anner Jair Reyes Trochez,476.0,118.0,105.0,48.0,10.0,4.0,3.0,3.0,41.0,5.0,20.0,77.0,33.0,9.0
131.0,Jimmy Edward Gonzalez Duran,477.0,160.0,75.0,48.0,10.0,4.0,3.0,3.0,41.0,5.0,20.0,71.0,28.0,9.0
132.0,Angel Gabriel Hurtado Rodriguez,479.0,150.0,92.0,48.0,10.0,4.0,3.0,3.0,41.0,5.0,20.0,64.0,30.0,9.0
133.0,Claudio Gabriel Santos Escobar,481.0,123.0,105.0,48.0,10.0,4.0,3.0,3.0,41.0,5.0,20.0,77.0,33.0,9.0
134.0,Ariel Isac Ramírez Barahona,482.0,141.0,88.0,48.0,10.0,4.0,3.0,3.0,41.0,5.0,20.0,77.0,33.0,9.0
134.0,Luis Antonio Santos,482.0,145.0,105.0,48.0,10.0,4.0,3.0,3.0,41.0,5.0,20.0,56.0,33.0,9.0
134.0,Angel Samuel Zaldívar Umana,482.0,161.0,105.0,48.0,10.0,4.0,3.0,3.0,41.0,5.0,20.0,40.0,33.0,9.0
137.0,Cristian Jexciel Castro Muñoz,483.0,125.0,105.0,48.0,10.0,4.0,3.0,3.0,41.0,5.0,20.0,77.0,33.0,9.0
138.0,Junior Jafeth Sanchez Gamez,484.0,126.0,105.0,48.0,10.0,4.0,3.0,3.0,41.0,5.0,20.0,77.0,33.0,9.0
139.0,Olvin Rene Bueso Enamordo,486.0,128.0,105.0,48.0,10.0,4.0,3.0,3.0,41.0,5.0,20.0,77.0,33.0,9.0
140.0,Bryan Antonio Portillo Flores,487.0,129.0,105.0,48.0,10.0,4.0,3.0,3.0,41.0,5.0,20.0,77.0,33.0,9.0
140.0,Jaime Jafeth Perez Ramos,487.0,138.0,96.0,48.0,10.0,4.0,3.0,3.0,41.0,5.0,20.0,77.0,33.0,9.0
142.0,Donovan Isai Peña Morales,489.0,131.0,105.0,48.0,10.0,4.0,3.0,3.0,41.0,5.0,20.0,77.0,33.0,9.0
143.0,Erick Javier Sam,490.0,132.0,105.0,48.0,10.0,4.0,3.0,3.0,41.0,5.0,20.0,77.0,33.0,9.0
143.0,Edwin Edgardo Hernandez Benites,490.0,137.0,105.0,48.0,10.0,4.0,3.0,3.0,41.0,5.0,20.0,72.0,33.0,9.0
145.0,Fernando Alberto Flores Laínez,493.0,146.0,95.0,48.0,10.0,4.0,3.0,3.0,41.0,5.0,20.0,77.0,32.0,9.0
146.0,Kevin David Rodríguez Pavón,495.0,139.0,105.0,48.0,10.0,4.0,3.0,3.0,41.0,5.0,20.0,75.0,33.0,9.0
147.0,Hancel Ulises Perdomo Canales,498.0,140.0,105.0,48.0,10.0,4.0,3.0,3.0,41.0,5.0,20.0,77.0,33.0,9.0
147.0,Samuel Octavio Alvarez Ramos,498.0,148.0,97.0,48.0,10.0,4.0,3.0,3.0,41.0,5.0,20.0,77.0,33.0,9.0
149.0,Miguel Alejandro Mejia Davila,499.0,144.0,105.0,48.0,10.0,4.0,3.0,3.0,41.0,5.0,20.0,74.0,33.0,9.0
150.0,Edson Manuel Urbina Hernández,500.0,142.0,105.0,48.0,10.0,4.0,3.0,3.0,41.0,5.0,20.0,77.0,33.0,9.0
151.0,Mariah Fernanda Cubas Cálix,501.0,143.0,105.0,48.0,10.0,4.0,3.0,3.0,41.0,5.0,20.0,77.0,33.0,9.0
151.0,Xavier Eduardo Rivera Martinez,501.0,159.0,100.0,48.0,10.0,4.0,3.0,3.0,41.0,5.0,20.0,66.0,33.0,9.0
153.0,Diego Roberto Carias Hernandez,505.0,149.0,103.0,48.0,10.0,4.0,3.0,3.0,41.0,5.0,20.0,77.0,33.0,9.0
153.0,Yazid Vladimir Trejo,505.0,147.0,105.0,48.0,10.0,4.0,3.0,3.0,41.0,5.0,20.0,77.0,33.0,9.0
155.0,Gabriel Isaac,509.0,154.0,102.0,48.0,10.0,4.0,3.0,3.0,41.0,5.0,20.0,77.0,33.0,9.0
156.0,Jonatan Caled Meza Argeñal,510.0,152.0,105.0,48.0,10.0,4.0,3.0,3.0,41.0,5.0,20.0,77.0,33.0,9.0
157.0,Yoser Esau Chavez Lara,511.0,153.0,105.0,48.0,10.0,4.0,3.0,3.0,41.0,5.0,20.0,77.0,33.0,9.0
158.0,Cesar David Madrid Gomez,513.0,155.0,105.0,48.0,10.0,4.0,3.0,3.0,41.0,5.0,20.0,77.0,33.0,9.0
159.0,Gabriel Alberto Sorto Aguilar,514.0,156.0,105.0,48.0,10.0,4.0,3.0,3.0,41.0,5.0,20.0,77.0,33.0,9.0
160.0,Juan Diego Sandoval Ortiz,515.0,157.0,105.0,48.0,10.0,4.0,3.0,3.0,41.0,5.0,20.0,77.0,33.0,9.0
161.0,Rodil David Manzanares Izaguirre,516.0,158.0,105.0,48.0,10.0,4.0,3.0,3.0,41.0,5.0,20.0,77.0,33.0,9.0
162.0,Yeimi Noemi Sagastume,520.0,162.0,105.0,48.0,10.0,4.0,3.0,3.0,41.0,5.0,20.0,77.0,33.0,9.0
162.0,Gerardo Enrique Orellana Acosta,520.0,174.0,93.0,48.0,10.0,4.0,3.0,3.0,41.0,5.0,20.0,77.0,33.0,9.0
164.0,Jesus Alejandro Reyes Castro,521.0,174.0,94.0,48.0,10.0,4.0,3.0,3.0,41.0,5.0,20.0,77.0,33.0,9.0
164.0,Nahomy Gisselle Pacheco,521.0,163.0,105.0,48.0,10.0,4.0,3.0,3.0,41.0,5.0,20.0,77.0,33.0,9.0
166.0,Raul Arturo Gerezano Euceda,522.0,164.0,105.0,48.0,10.0,4.0,3.0,3.0,41.0,5.0,20.0,77.0,33.0,9.0
166.0,Harol Jafet Hernández Cáceres,522.0,174.0,105.0,48.0,10.0,4.0,3.0,3.0,41.0,5.0,20.0,67.0,33.0,9.0
168.0,Diego Alejandro Campos Garcia,523.0,165.0,105.0,48.0,10.0,4.0,3.0,3.0,41.0,5.0,20.0,77.0,33.0,9.0
169.0,Hector Yovani Medina,524.0,166.0,105.0,48.0,10.0,4.0,3.0,3.0,41.0,5.0,20.0,77.0,33.0,9.0
170.0,Jose Isrrael Perez Hernandez,525.0,167.0,105.0,48.0,10.0,4.0,3.0,3.0,41.0,5.0,20.0,77.0,33.0,9.0
171.0,Lot Esaú Rivera Velásquez,526.0,172.0,101.0,48.0,10.0,4.0,3.0,3.0,41.0,5.0,20.0,77.0,33.0,9.0
171.0,Sheyla Yamileth Bautista,526.0,168.0,105.0,48.0,10.0,4.0,3.0,3.0,41.0,5.0,20.0,77.0,33.0,9.0
173.0,Jostin Daniel Zúniga Mejía,527.0,169.0,105.0,48.0,10.0,4.0,3.0,3.0,41.0,5.0,20.0,77.0,33.0,9.0
174.0,Daniel Maximiliano Molina Juarez,528.0,170.0,105.0,48.0,10.0,4.0,3.0,3.0,41.0,5.0,20.0,77.0,33.0,9.0
175.0,Oscar Ruben Garcia Alberto,529.0,171.0,105.0,48.0,10.0,4.0,3.0,3.0,41.0,5.0,20.0,77.0,33.0,9.0
176.0,Ismael Mejia,530.0,173.0,104.0,48.0,10.0,4.0,3.0,3.0,41.0,5.0,20.0,77.0,33.0,9.0
